url,complaint
"https://www.sikayetvar.com/turkcell/turkcell-cekmiyor-istanbul-gibi-bir-sehirde
","8-9 ay önce taşınmış olduğum evde telefon hiç çekmiyor. Arayanlar sürekli telefonun kapalı olduğunu, ulaşamadıklarını söylüyorlar. Komşularıma sorduğumda onlarında aynı sorunu yaşadığını söylüyorlar. İstanbul/Bahçelievler/Yenibosna merkez Mahallesi/Balkan sokak. Daha önce de bildirmeme rağmen talebiniz alınmış fakat bir çözüme ulaştırılamamıştır diye mesaj göndermişler."
"https://www.sikayetvar.com/turkcell/turkcell-superbox-internet-farkli-modem-ile-kullanılamıyor
","Turkcell Superbox internetimi farklı modem ile kullanamıyorum. Böyle saçmalık olamaz. Taşınabilir prizden bağımsız TP-Link modem aldım ancak internete giremiyorum. Media Markt çalışanı da beni yanlış bilgilendirdi, kullanabilirsiniz dedi. Turkcell zaten telefona bakmıyor."
https://www.sikayetvar.com/turkcell/turkcell-faturali-hat-abonelik-yenileme,"Turkcell faturalı hat abonelik yenilemelerinde paketiniz henüz bitmemişken 'ne olur ne olmaz' düşüncesiyle önceden paketinizi yenilemeniz durumunda, son aylık ödemenizin üzerine yeni aldığınız paket ücretinin kullandığınız gün sayısı kadarı faturanıza eklenmektedir. Üstelik paketi yükseltmiyorum, bitmek üzere olan paketimi yeniliyorum. Paketin bitiminden hemen sonra, yani fatura kesim tarihinin ertesi günü yeni paket ücretlendirmesinin başlaması daha doğru olacaktır. 'Paketiniz bitiyor, yenileyin' ifadesi bir pazarlama taktiğidir ve tüketiciyi yanlış yönlendirmektedir. Ne kadar erken yenilerseniz, o kadar çok fatura üst üste binecektir. Bu durum, haksız gelir elde etmeye yol açmaktadır."
